<?xml-model href="../.ref/schema/SanteDBApplet.xsd" type="application/xml" schematypens="http://www.w3.org/2001/XMLSchema"?>
<!--
 - Copyright 2021-2025 SanteSuite Contributors (See NOTICE.md for full copyright notices)
 - Portions Copyright (C) 2019 - 2021, Fyfe Software Inc. and the SanteSuite Contributors
 - Portions Copyright (C) 2015-2018 Mohawk College of Applied Arts and Technology
 - 
 - Licensed under the Apache License, Version 2.0 (the "License"); you 
 - may not use this file except in compliance with the License. You may 
 - obtain a copy of the License at 
 - 
 - http://www.apache.org/licenses/LICENSE-2.0 
 - 
 - Unless required by applicable law or agreed to in writing, software
 - distributed under the License is distributed on an "AS IS" BASIS, WITHOUT
 - WARRANTIES OR CONDITIONS OF ANY KIND, either express or implied. See the 
 - License for the specific language governing permissions and limitations under 
 - the License.
 -->
<AppletManifest  xmlns="http://santedb.org/applet" xmlns:xsi="http://www.w3.org/2001/XMLSchema-instance"
  xsi:schemaLocation="http://santedb.org/applet http://santedb.org/schema/v3.0/Applet.xsd">

  <info id="org.santedb.core" version="3.0.0.0" uuid="1f5825da-8c11-400c-939a-94c3507da427">
    <icon>/org.santedb.core/img/icon.png</icon>
    <name lang="en">SanteDB Core Applet</name>
    <author>SanteSuite Community Partners (see: santesuite.org)</author>
  </info>

  <errors>
    <add code="403" asset="/org.santedb.core/views/error/403.html" />
    <add code="404" asset="/org.santedb.core/views/error/404.html" />
    <add code="500" asset="/org.santedb.core/views/error/500.html" />
  </errors>


  <viewModel key="mail">
    <definition>/org.santedb.core/model/mail.xml</definition>
  </viewModel>
  <viewModel key="base">
    <definition>/org.santedb.core/model/base.xml</definition>
  </viewModel>
  <viewModel key="min">
    <definition>/org.santedb.core/model/min.xml</definition>
  </viewModel>
  <viewModel key="history">
    <definition>/org.santedb.core/model/history.xml</definition>
  </viewModel>
  <viewModel key="full">
    <definition>/org.santedb.core/model/full.xml</definition>
  </viewModel>
  <viewModel key="fastview">
    <definition>/org.santedb.core/model/fastview.xml</definition>
  </viewModel>
  <viewModel key="dropdown">
    <definition>/org.santedb.core/model/dropdown.xml</definition>
  </viewModel>
  <viewModel key="mdm">
    <definition>/org.santedb.core/model/mdm.xml</definition>
  </viewModel>
  <viewModel key="reverseRelationship">
    <definition>/org.santedb.core/model/reverseRelationship.xml</definition>
  </viewModel>
  <viewModel key="relationship">
    <definition>/org.santedb.core/model/relationship.xml</definition>
  </viewModel>
  <viewModel key="concept">
    <definition>/org.santedb.core/model/concept.xml</definition>
  </viewModel>
  <viewModel key="attribution">
    <definition>/org.santedb.core/model/attribution.xml</definition>
  </viewModel>
  <viewModel key="noModelProperties">
    <definition>/org.santedb.core/model/noModelProperties.xml</definition>
  </viewModel>
</AppletManifest>